{
  "schemaVersion": "1.0.0",
  "protocol": "A2A/1.0.0",
  "id": "oracle-plsql-expert",
  "name": "Oracle Plsql Expert",
  "version": "1.0.0",
  "description": "Especialista em Oracle PL/SQL: implementa Packages (spec/body), Procedures, Functions, Triggers, cursores, BULK COLLECT, FORALL e tratamento de exceções com RAISE_APPLICATION_ERROR sob TDD/validação estrita.",
  "domain": "Desenvolvimento e manutenção de Stored Procedures, Functions, Packages e Triggers em Oracle PL/SQL",
  "role": "specialist",
  "capabilities": [
    "plsql",
    "pl/sql",
    "procedure oracle",
    "function oracle",
    "package oracle",
    "package body",
    "trigger oracle",
    "bulk collect",
    "forall oracle",
    "cursor plsql"
  ],
  "skills": [
    "agent-contracts",
    "handoff-governance"
  ],
  "tools": [
    "file_search",
    "grep_search",
    "list_dir",
    "ask_questions",
    "run_subagent",
    "get_errors",
    "run_in_terminal",
    "context-mode/ctx_execute",
    "context-mode/ctx_search",
    "context-mode/ctx_batch_execute",
    "context-mode/ctx_index",
    "context-mode/ctx_execute_file"
  ],
  "security_profile": {
    "tool_zones": [
      "read-only",
      "execution"
    ],
    "least_privilege_level": "elevated",
    "data_sensitivity": "internal"
  },
  "model_preferences": {
    "recommended_model": "Claude Sonnet 5",
    "cost_tier": "1x"
  },
  "input_contract": {
    "accepts_payload": "yaml / markdown",
    "required_fields": [
      "emissor",
      "contexto",
      "motivo"
    ]
  },
  "output_contract": {
    "expected_format": "markdown estruturado com Agente Ativo e Handoff",
    "emits_handoff": true,
    "context_offloading_supported": true
  },
  "metadata": {
    "catalog_source": ".github/agents/backend/database/database-catalog.yaml",
    "priority": 10,
    "estimated_time_minutes": 15
  }
}
