{
  "schemaVersion": "1.0.0",
  "protocol": "A2A/1.0.0",
  "id": "react-e2e-writer",
  "name": "React E2E Writer",
  "version": "1.0.0",
  "description": "Escreve suítes E2E de jornadas completas no browser, adotando seletores estáveis (data-testid), Page Objects e asserções web-first.",
  "domain": "Testes ponta a ponta (E2E) com Playwright em aplicações React",
  "role": "specialist",
  "capabilities": [
    "e2e react",
    "playwright react",
    "teste ponta a ponta",
    "jornada do usuario"
  ],
  "skills": [
    "agent-contracts",
    "handoff-governance"
  ],
  "tools": [
    "file_search",
    "grep_search",
    "list_dir",
    "ask_questions",
    "run_subagent",
    "get_errors",
    "run_in_terminal",
    "context-mode/ctx_execute",
    "context-mode/ctx_search",
    "context-mode/ctx_batch_execute",
    "context-mode/ctx_execute_file",
    "context-mode/ctx_index",
    "playwright/browser_snapshot",
    "playwright/browser_navigate",
    "playwright/browser_navigate_back",
    "playwright/browser_click",
    "playwright/browser_type",
    "playwright/browser_hover",
    "playwright/browser_select_option",
    "playwright/browser_press_key",
    "playwright/browser_fill_form",
    "playwright/browser_file_upload",
    "playwright/browser_handle_dialog",
    "playwright/browser_wait_for",
    "playwright/browser_tabs",
    "playwright/browser_close",
    "playwright/browser_console_messages",
    "playwright/browser_network_requests",
    "playwright/browser_take_screenshot",
    "playwright/browser_resize"
  ],
  "security_profile": {
    "tool_zones": [
      "read-only",
      "execution"
    ],
    "least_privilege_level": "elevated",
    "data_sensitivity": "internal"
  },
  "model_preferences": {
    "recommended_model": "Gemini 3.8 Flash",
    "cost_tier": "1x"
  },
  "input_contract": {
    "accepts_payload": "yaml / markdown",
    "required_fields": [
      "emissor",
      "contexto",
      "motivo"
    ]
  },
  "output_contract": {
    "expected_format": "markdown estruturado com Agente Ativo e Handoff",
    "emits_handoff": true,
    "context_offloading_supported": true
  },
  "metadata": {
    "catalog_source": ".github/agents/frontend/react/react-catalog.yaml",
    "priority": 10,
    "estimated_time_minutes": 15
  }
}
