{
  "schemaVersion": "1.0.0",
  "protocol": "A2A/1.0.0",
  "id": "spring-reactive-feature-developer",
  "name": "Spring Reactive Feature Developer",
  "version": "1.0.0",
  "description": "Desenvolvedor de features: cria RouterFunctions/Controllers reativos, pipelines não-bloqueantes com Mono/Flux, R2DBC e Records sob TDD.",
  "domain": "Desenvolvimento de endpoints reativos, pipelines funcionais WebFlux, R2DBC e DTOs Records via TDD",
  "role": "implementer",
  "capabilities": [
    "feature webflux",
    "endpoint reativo",
    "mono flux",
    "r2dbc",
    "tdd reativo",
    "routerfunction"
  ],
  "skills": [
    "agent-contracts",
    "handoff-governance"
  ],
  "tools": [
    "file_search",
    "grep_search",
    "list_dir",
    "ask_questions",
    "run_subagent",
    "get_errors",
    "run_in_terminal",
    "context-mode/ctx_execute",
    "context-mode/ctx_search",
    "context-mode/ctx_batch_execute",
    "context-mode/ctx_index",
    "context-mode/ctx_execute_file"
  ],
  "security_profile": {
    "tool_zones": [
      "read-only",
      "mutating",
      "execution"
    ],
    "least_privilege_level": "elevated",
    "data_sensitivity": "internal"
  },
  "model_preferences": {
    "recommended_model": "Claude Sonnet 5",
    "cost_tier": "1x"
  },
  "input_contract": {
    "accepts_payload": "yaml / markdown",
    "required_fields": [
      "emissor",
      "contexto",
      "motivo"
    ]
  },
  "output_contract": {
    "expected_format": "markdown estruturado com Agente Ativo e Handoff",
    "emits_handoff": true,
    "context_offloading_supported": true
  },
  "metadata": {
    "catalog_source": ".github/agents/backend/spring-reactive/spring-reactive-catalog.yaml",
    "priority": 10,
    "estimated_time_minutes": 15
  }
}