{
  "schemaVersion": "1.0.0",
  "protocol": "A2A/1.0.0",
  "id": "spring-reactive-router",
  "name": "Spring Reactive Router",
  "version": "2.0.0",
  "description": "Roteador de domínio Spring Reactive e supervisor hierárquico — recebe solicitações de backend reativo (WebFlux/Reactor/R2DBC) do agent-router central e despacha para os 7 especialistas reativos (arch-advisor, feature-developer, bug-fixer, perf-tuner, unit-test-writer, integration-test-writer, test-fixer).",
  "domain": "Supervisor hierarquico e roteador do dominio Spring Reactive",
  "role": "router",
  "capabilities": [
    "spring webflux",
    "spring reactive router",
    "project reactor",
    "backend reativo",
    "backpressure",
    "r2dbc"
  ],
  "skills": [
    "agent-contracts",
    "handoff-governance",
    "context-mode"
  ],
  "tools": [
    "read_file",
    "file_search",
    "grep_search",
    "list_dir",
    "ask_questions",
    "run_subagent",
    "context-mode/ctx_search"
  ],
  "security_profile": {
    "tool_zones": [
      "read-only"
    ],
    "least_privilege_level": "standard",
    "data_sensitivity": "internal"
  },
  "model_preferences": {
    "recommended_model": "Claude Sonnet 5",
    "cost_tier": "1x"
  },
  "input_contract": {
    "accepts_payload": "yaml / markdown",
    "required_fields": [
      "emissor",
      "contexto",
      "motivo"
    ]
  },
  "output_contract": {
    "expected_format": "markdown estruturado com Agente Ativo e Handoff",
    "emits_handoff": true,
    "context_offloading_supported": true
  },
  "metadata": {
    "catalog_source": ".github/agents/catalog.yaml",
    "priority": 8.8,
    "estimated_time_minutes": 15
  }
}