{
  "schemaVersion": "1.0.0",
  "protocol": "A2A/1.0.0",
  "id": "python-unit-test-writer",
  "name": "Python Unit Test Writer",
  "version": "1.0.0",
  "description": "Escreve testes unitários isolados com pytest: testa services e regras de negócio puras com fixtures bem delimitadas, mocks com spec e alta cobertura (>=80%).",
  "domain": "Testes unitários puros em Python com pytest, pytest-mock, unittest.mock e fixtures em conftest.py",
  "role": "tester",
  "capabilities": [
    "teste unitario python",
    "pytest",
    "pytest mock",
    "fixtures conftest",
    "testar service python",
    "unit test python"
  ],
  "skills": [
    "agent-contracts",
    "handoff-governance"
  ],
  "tools": [
    "file_search",
    "grep_search",
    "list_dir",
    "ask_questions",
    "run_subagent",
    "get_errors",
    "run_in_terminal",
    "context-mode/ctx_execute",
    "context-mode/ctx_search",
    "context-mode/ctx_batch_execute",
    "context-mode/ctx_execute_file",
    "context-mode/ctx_index"
  ],
  "security_profile": {
    "tool_zones": [
      "read-only",
      "execution"
    ],
    "least_privilege_level": "elevated",
    "data_sensitivity": "internal"
  },
  "model_preferences": {
    "recommended_model": "Gemini 3.8 Flash",
    "cost_tier": "1x"
  },
  "input_contract": {
    "accepts_payload": "yaml / markdown",
    "required_fields": [
      "emissor",
      "contexto",
      "motivo"
    ]
  },
  "output_contract": {
    "expected_format": "markdown estruturado com Agente Ativo e Handoff",
    "emits_handoff": true,
    "context_offloading_supported": true
  },
  "metadata": {
    "catalog_source": ".github/agents/backend/python/python-catalog.yaml",
    "priority": 10,
    "estimated_time_minutes": 15
  }
}
