{
  "schemaVersion": "1.0.0",
  "protocol": "A2A/1.0.0",
  "id": "struts-bug-fixer",
  "name": "Struts Bug Fixer",
  "version": "1.0.0",
  "description": "Especialista em resolução rápida de bugs Struts: corrige falhas de ActionForward, ClassCastException em ActionForm, loops de redirecionamento e concorrência com diff mínimo.",
  "domain": "Correções cirúrgicas de falhas em Struts: ClassCastException em form-beans, forwards nulos, thread-safety em Actions, vazamentos de sessão",
  "role": "fixer",
  "capabilities": [
    "bug struts",
    "fix struts",
    "actionforward nulo",
    "classcastexception formbean",
    "thread safety action",
    "session leak struts",
    "corrigir erro struts"
  ],
  "skills": [
    "agent-contracts",
    "handoff-governance"
  ],
  "tools": [
    "file_search",
    "grep_search",
    "list_dir",
    "ask_questions",
    "run_subagent",
    "get_errors",
    "run_in_terminal",
    "context-mode/ctx_execute",
    "context-mode/ctx_search",
    "context-mode/ctx_batch_execute",
    "context-mode/ctx_execute_file",
    "context-mode/ctx_index"
  ],
  "security_profile": {
    "tool_zones": [
      "read-only",
      "mutating",
      "execution"
    ],
    "least_privilege_level": "elevated",
    "data_sensitivity": "internal"
  },
  "model_preferences": {
    "recommended_model": "Claude Sonnet 5",
    "cost_tier": "1x"
  },
  "input_contract": {
    "accepts_payload": "yaml / markdown",
    "required_fields": [
      "emissor",
      "contexto",
      "motivo"
    ]
  },
  "output_contract": {
    "expected_format": "markdown estruturado com Agente Ativo e Handoff",
    "emits_handoff": true,
    "context_offloading_supported": true
  },
  "metadata": {
    "catalog_source": ".github/agents/backend/struts/struts-catalog.yaml",
    "priority": 10,
    "estimated_time_minutes": 15
  }
}