{
  "schemaVersion": "1.0.0",
  "protocol": "A2A/1.0.0",
  "id": "struts-developer",
  "name": "Struts Developer",
  "version": "1.0.0",
  "description": "Especialista mutativo core: implementa Actions, DispatchActions, FormBeans (ActionForm/DynaActionForm), descritores XML, resolve bugs cirúrgicos (ActionForwards, ClassCastException, vazamentos de sessão) com diff mínimo e otimiza rendering Tiles/JSP e elimina session bloat.",
  "domain": "Desenvolvimento de Produção Struts, Actions, FormBeans, Mapeamentos XML, Correção Cirúrgica de Bugs e Otimização de Performance",
  "role": "implementer",
  "capabilities": [
    "feature struts",
    "action struts",
    "dispatchaction",
    "formbean",
    "actionform",
    "dynaactionform",
    "struts-config",
    "bugfix struts",
    "tuning struts",
    "session bloat",
    "tiles render"
  ],
  "skills": [
    "agent-contracts",
    "handoff-governance"
  ],
  "tools": [
    "file_search",
    "grep_search",
    "list_dir",
    "ask_questions",
    "run_subagent",
    "get_errors",
    "run_in_terminal",
    "context-mode/ctx_execute",
    "context-mode/ctx_search",
    "context-mode/ctx_batch_execute",
    "context-mode/ctx_index",
    "context-mode/ctx_execute_file"
  ],
  "security_profile": {
    "tool_zones": [
      "read-only",
      "mutating",
      "execution"
    ],
    "least_privilege_level": "elevated",
    "data_sensitivity": "internal"
  },
  "model_preferences": {
    "recommended_model": "Claude Sonnet 5.5",
    "cost_tier": "1x"
  },
  "input_contract": {
    "accepts_payload": "yaml / markdown",
    "required_fields": [
      "emissor",
      "contexto",
      "motivo"
    ]
  },
  "output_contract": {
    "expected_format": "markdown estruturado com Agente Ativo e Handoff",
    "emits_handoff": true,
    "context_offloading_supported": true
  },
  "metadata": {
    "catalog_source": ".github/agents/backend/struts/struts-catalog.yaml",
    "priority": 10,
    "estimated_time_minutes": 15
  }
}
