{
  "schemaVersion": "1.0.0",
  "protocol": "A2A/1.0.0",
  "id": "struts-integration-test-writer",
  "name": "Struts Integration Test Writer",
  "version": "1.0.0",
  "description": "Escreve testes de integração para Struts: valida ciclo ActionServlet, cadeia de interceptors/filtros, parsing de struts-config.xml e persistência via Testcontainers.",
  "domain": "Testes de integração do ciclo completo de requisição Struts com container servlet emulado (Tomcat/Jetty embutido) e Testcontainers",
  "role": "tester",
  "capabilities": [
    "teste integracao struts",
    "actionservlet test",
    "ciclo completo struts",
    "testcontainers struts",
    "jetty embedded struts"
  ],
  "skills": [
    "agent-contracts",
    "handoff-governance"
  ],
  "tools": [
    "file_search",
    "grep_search",
    "list_dir",
    "ask_questions",
    "run_subagent",
    "get_errors",
    "run_in_terminal",
    "context-mode/ctx_execute",
    "context-mode/ctx_search",
    "context-mode/ctx_batch_execute",
    "context-mode/ctx_execute_file",
    "context-mode/ctx_index"
  ],
  "security_profile": {
    "tool_zones": [
      "read-only",
      "execution"
    ],
    "least_privilege_level": "elevated",
    "data_sensitivity": "internal"
  },
  "model_preferences": {
    "recommended_model": "Gemini 3.8 Flash",
    "cost_tier": "1x"
  },
  "input_contract": {
    "accepts_payload": "yaml / markdown",
    "required_fields": [
      "emissor",
      "contexto",
      "motivo"
    ]
  },
  "output_contract": {
    "expected_format": "markdown estruturado com Agente Ativo e Handoff",
    "emits_handoff": true,
    "context_offloading_supported": true
  },
  "metadata": {
    "catalog_source": ".github/agents/backend/struts/struts-catalog.yaml",
    "priority": 10,
    "estimated_time_minutes": 15
  }
}
