{
  "schemaVersion": "1.0.0",
  "protocol": "A2A/1.0.0",
  "id": "spring-reactive-arch-advisor",
  "name": "Spring Reactive Arch Advisor",
  "version": "1.0.0",
  "description": "Read-only advisor para arquitetura reativa Spring WebFlux, Reactor (Mono/Flux), R2DBC e fluxos assíncronos não-bloqueantes.",
  "domain": "Engenharia de Software / Governança Multi-Agente",
  "role": "advisor",
  "capabilities": [
    "arquitetura spring reactive",
    "webflux blueprint",
    "mono flux design",
    "r2dbc architecture",
    "backpressure strategy"
  ],
  "skills": [
    "agent-contracts",
    "handoff-governance"
  ],
  "tools": [
    "read_file",
    "file_search",
    "grep_search",
    "list_dir",
    "ask_questions",
    "context-mode/ctx_search",
    "context-mode/ctx_execute_file"
  ],
  "security_profile": {
    "tool_zones": [
      "read-only"
    ],
    "least_privilege_level": "strict",
    "data_sensitivity": "internal"
  },
  "model_preferences": {
    "recommended_model": "Claude Sonnet 5.5",
    "cost_tier": "1x"
  },
  "input_contract": {
    "accepts_payload": "yaml / markdown",
    "required_fields": [
      "emissor",
      "contexto",
      "motivo"
    ]
  },
  "output_contract": {
    "expected_format": "markdown estruturado com Agente Ativo e Handoff",
    "emits_handoff": true,
    "context_offloading_supported": true
  },
  "metadata": {
    "catalog_source": ".github/agents/backend/spring-reactive/spring-reactive-catalog.yaml",
    "priority": 10,
    "estimated_time_minutes": 15
  }
}
