{
  "schemaVersion": "1.0.0",
  "protocol": "A2A/1.0.0",
  "id": "spring-boot-developer",
  "name": "Spring Boot Developer",
  "version": "1.0.0",
  "description": "Especialista mutativo core: constrói endpoints REST e services transacionais, executa correção cirúrgica de bugs com diff mínimo e aplica otimizações de performance (queries N+1, HikariCP, cache).",
  "domain": "Desenvolvimento de Produção, REST Endpoints, Jakarta Persistence, Bugfix e Tuning de Performance",
  "role": "implementer",
  "capabilities": [
    "feature spring boot",
    "endpoint rest spring",
    "service transacional",
    "jakarta persistence",
    "entidade jpa",
    "bugfix spring",
    "resolucao de bug spring",
    "performance spring boot",
    "query n+1",
    "hikaricp"
  ],
  "skills": [
    "agent-contracts",
    "handoff-governance"
  ],
  "tools": [
    "file_search",
    "grep_search",
    "list_dir",
    "ask_questions",
    "run_subagent",
    "get_errors",
    "run_in_terminal",
    "context-mode/ctx_execute",
    "context-mode/ctx_search",
    "context-mode/ctx_batch_execute",
    "context-mode/ctx_index",
    "context-mode/ctx_execute_file"
  ],
  "security_profile": {
    "tool_zones": [
      "read-only",
      "mutating",
      "execution"
    ],
    "least_privilege_level": "elevated",
    "data_sensitivity": "internal"
  },
  "model_preferences": {
    "recommended_model": "Claude Sonnet 5.5",
    "cost_tier": "1x"
  },
  "input_contract": {
    "accepts_payload": "yaml / markdown",
    "required_fields": [
      "emissor",
      "contexto",
      "motivo"
    ]
  },
  "output_contract": {
    "expected_format": "markdown estruturado com Agente Ativo e Handoff",
    "emits_handoff": true,
    "context_offloading_supported": true
  },
  "metadata": {
    "catalog_source": ".github/agents/backend/spring-boot/spring-boot-catalog.yaml",
    "priority": 10,
    "estimated_time_minutes": 15
  }
}
