{
  "schemaVersion": "1.0.0",
  "protocol": "A2A/1.0.0",
  "id": "struts-test-engineer",
  "name": "Struts Test Engineer",
  "version": "1.0.0",
  "description": "Especialista mutativo de testes: implementa testes unitários isolados com Mockito e StrutsTestCase (Actions e FormBeans sem Servlet Container), testes de integração em contêiner emulado (Tomcat/Jetty, interceptors, Testcontainers) e realiza diagnóstico e autocorreção de testes com retry cap R-053.",
  "domain": "Garantia de Qualidade, Testes Unitários StrutsTestCase/Mockito, Testes de Integração Tomcat/Jetty Emulado e Autocorreção sob R-053",
  "role": "tester",
  "capabilities": [
    "testes struts",
    "teste unitario struts",
    "strutstestcase",
    "mock servlet",
    "teste integracao struts",
    "corrigir teste struts",
    "test fixer struts",
    "testcontainers struts"
  ],
  "skills": [
    "agent-contracts",
    "handoff-governance"
  ],
  "tools": [
    "file_search",
    "grep_search",
    "list_dir",
    "ask_questions",
    "run_subagent",
    "get_errors",
    "run_in_terminal",
    "context-mode/ctx_execute",
    "context-mode/ctx_search",
    "context-mode/ctx_batch_execute",
    "context-mode/ctx_index",
    "context-mode/ctx_execute_file"
  ],
  "security_profile": {
    "tool_zones": [
      "read-only",
      "execution"
    ],
    "least_privilege_level": "elevated",
    "data_sensitivity": "internal"
  },
  "model_preferences": {
    "recommended_model": "Claude Sonnet 5.5",
    "cost_tier": "1x"
  },
  "input_contract": {
    "accepts_payload": "yaml / markdown",
    "required_fields": [
      "emissor",
      "contexto",
      "motivo"
    ]
  },
  "output_contract": {
    "expected_format": "markdown estruturado com Agente Ativo e Handoff",
    "emits_handoff": true,
    "context_offloading_supported": true
  },
  "metadata": {
    "catalog_source": ".github/agents/backend/struts/struts-catalog.yaml",
    "priority": 10,
    "estimated_time_minutes": 15
  }
}
